{
  "$schema": "http://json-schema.org/draft-07/schema#",
  "title": "Interval Workout",
  "type": "object",
  "additionalProperties": false,
  "required": ["name", "intervals"],
  "properties": {
    "name": {
      "type": "string",
      "description": "Friendly workout name (e.g. '10×300/100/200 + rest')"
    },
    "warmup": {
      "type": "object",
      "description": "Optional easy running before the first interval (lap-based if distance and duration omitted)",
      "additionalProperties": false,
      "properties": {
        "distance": {
          "type": "integer",
          "minimum": 1,
          "description": "Distance in metres"
        },
        "duration": {
          "type": "integer",
          "minimum": 1,
          "description": "Duration in seconds (for a step given by time)"
        },
        "pace": {
          "type": "string",
          "pattern": "^[0-9]+:[0-5][0-9]$",
          "description": "Optional target pace (min:sec per km)"
        },
        "pace_slow": {
          "type": "string",
          "pattern": "^[0-9]+:[0-5][0-9]$",
          "description": "Slow end of a stated pace range (min:sec per km); 'pace' is then the fast end"
        }
      }
    },
    "intervals": {
      "type": "array",
      "description": "Main workout segment consisting of run/rest steps or repeat groups",
      "items": { "$ref": "#/definitions/element" }
    },
    "cooldown": {
      "type": "object",
      "description": "Optional easy running after the last interval (lap-based if distance and duration omitted)",
      "additionalProperties": false,
      "properties": {
        "distance": {
          "type": "integer",
          "minimum": 1,
          "description": "Distance in metres"
        },
        "duration": {
          "type": "integer",
          "minimum": 1,
          "description": "Duration in seconds (for a step given by time)"
        },
        "pace": {
          "type": "string",
          "pattern": "^[0-9]+:[0-5][0-9]$",
          "description": "Optional target pace (min:sec per km)"
        },
        "pace_slow": {
          "type": "string",
          "pattern": "^[0-9]+:[0-5][0-9]$",
          "description": "Slow end of a stated pace range (min:sec per km); 'pace' is then the fast end"
        }
      }
    }
  },
  "definitions": {
    "runStep": {
      "type": "object",
      "description": "A running segment, by distance or by time. Omit 'pace' to model an easy recovery jog.",
      "required": ["type"],
      "anyOf": [{ "required": ["distance"] }, { "required": ["duration"] }],
      "additionalProperties": false,
      "properties": {
        "type": { "const": "run" },
        "distance": {
          "type": "integer",
          "minimum": 1,
          "description": "Distance in metres"
        },
        "duration": {
          "type": "integer",
          "minimum": 1,
          "description": "Duration in seconds (for a step given by time)"
        },
        "pace": {
          "type": "string",
          "pattern": "^[0-9]+:[0-5][0-9]$",
          "description": "Target pace (min:sec per km)"
        },
        "pace_slow": {
          "type": "string",
          "pattern": "^[0-9]+:[0-5][0-9]$",
          "description": "Slow end of a stated pace range (min:sec per km); 'pace' is then the fast end"
        }
      }
    },
    "restStep": {
      "type": "object",
      "description": "Passive or standing rest.",
      "required": ["type", "rest"],
      "additionalProperties": false,
      "properties": {
        "type": { "const": "rest" },
        "rest": {
          "type": "integer",
          "minimum": 1,
          "description": "Rest duration in seconds"
        }
      }
    },
    "recoveryStep": {
      "type": "object",
      "description": "An active recovery jog segment without a target pace, by distance or by time.",
      "required": ["type"],
      "anyOf": [{ "required": ["distance"] }, { "required": ["duration"] }],
      "additionalProperties": false,
      "properties": {
        "type": { "const": "recovery" },
        "distance": {
          "type": "integer",
          "minimum": 1,
          "description": "Distance in metres"
        },
        "duration": {
          "type": "integer",
          "minimum": 1,
          "description": "Duration in seconds (for a step given by time)"
        }
      }
    },
    "breakStep": {
      "type": "object",
      "description": "A non-running drill done in place between runs (strength, plyometrics, mobility). Ends on the lap button.",
      "required": ["type", "name"],
      "additionalProperties": false,
      "properties": {
        "type": { "const": "break" },
        "name": {
          "type": "string",
          "maxLength": 100,
          "description": "The exercise, e.g. '30 frog jumps'"
        }
      }
    },
    "repeatGroup": {
      "type": "object",
      "description": "A grouping that repeats its internal steps in order.",
      "required": ["type", "repeat", "steps"],
      "additionalProperties": false,
      "properties": {
        "type": { "const": "repeat" },
        "repeat": {
          "type": "integer",
          "minimum": 1,
          "description": "Number of repetitions"
        },
        "steps": {
          "type": "array",
          "items": { "$ref": "#/definitions/element" },
          "description": "Ordered list of steps to repeat"
        }
      }
    },
    "element": {
      "oneOf": [
        { "$ref": "#/definitions/runStep" },
        { "$ref": "#/definitions/restStep" },
        { "$ref": "#/definitions/recoveryStep" },
        { "$ref": "#/definitions/breakStep" },
        { "$ref": "#/definitions/repeatGroup" }
      ]
    }
  }
}
